{
    "report_id": "metrics_20250508_initial",
    "timestamp_utc": "2025-05-08T11:00:00Z",
    "audit_process_id": "audit_20250508_initial",
    "metrics": [
        {
            "module": "agent_core.py",
            "cyclomatic_complexity": 18,
            "dependency_count": 5,
            "cognitive_complexity": 12
        },
        {
            "module": "memory_manager.py",
            "cyclomatic_complexity": 22,
            "dependency_count": 3,
            "cognitive_complexity": 18
        }
    ],
    "summary": {
        "total_modules_analyzed": 2,
        "critical_cyclomatic_complexity_found": 1,
        "warning_cognitive_complexity_found": 1
    }
}
